TEXT,CATEGORY
"BENGALURU, India (AP) — Climate change is battering Asia’s water and power systems and putting millions in harm’s way, forcing countries to pour billions into shoring up basic services, according to two recent reports.

Water-related disasters are rising across the region even as spending to protect communities falls short. Asian nations will need $4 trillion for water and sanitation between 2025 and 2040 — about $250 billion a year, the Asian Development Bank said in a report released Monday.

Governments are under growing pressure to protect power systems people rely on every day. By 2050, extreme weather could leave listed power companies in Asia-Pacific with about $8.4 billion a year in damage and lost revenue, a third higher than now, according to recent research by the Hong Kong-based non-profit Asia Investor Group on Climate Change and the New York-based MSCI Institute, a sustainability think tank.

Those risks have been playing out this year across Asia as it was pummeled by late-arriving storms, relentless rains and severe floods.

In central Vietnam’s Quy Nhon, power lines snapped when Typhoon Kalmaegi blasted the coastal city with heavy rain and strong winds. Floods from the relentless downpours left streets submerged under chest-high water days later, turning entire neighborhoods into islands. The day after the storm made landfall, Hai Duong, 29, rushed to a mall that still had power to charge her phone.

“I can’t go back because my home is underwater. I just want to see if my relatives are safe,” she said.
Asia’s water resources need to be climate proofed

The ADB report says 2.7 billion people, about 60% of the Asia-Pacific population, have access to water for most of their basic needs but more than 4 billion still remain exposed to unsafe water, degraded ecosystems and escalating climate hazards.

Much of the progress since 2013 comes from major gains in rural water access, it says. About 800 million more people in rural areas now have piped water, helping many countries move out of the lowest level of water security. India played a big part in this shift.

But Asia faces a triple threat: environmental pressures, low investment and climate change, said Vivek Raman, principal urban development specialist at the ADB and a lead author of the report.

“It’s a tale of two realities,” Raman said.

The report says water ecosystems were rapidly deteriorating or stagnating in 30 of the 50 Asian countries that were studied, plagued by unchecked development, pollution and land being converted to other uses. Asia also accounts for 41% of global flooding and its coastal megacities and Pacific islands face mounting threats from storm surges, rising sea levels and salty water pushing inland. From 2013 to 2023, Asia and the Pacific experienced 244 major floods, 104 droughts, and 101 severe storms — events that undermined development gains and caused widespread damage.

Governments currently meet only 40% of the estimated $4 trillion in investment, or roughly $250 billion annually, in funding needed for water and sanitation from 2025-2040. That leaves an annual shortfall of over $150 billion.

Asia’s rapid growth is both an opportunity and a challenge said Amit Prothi, director general of New Delhi-based Coalition for Disaster Resilient Infrastructure, who was not involved with the report. “The amount of infrastructure we’ll build in Asia in the next three decades will be as much as what was built in the last two centuries. So, this is an opportunity to rethink and build in a new way,” he said.

The coalition found that $800 billion in infrastructure, about a third of it in Asia, is exposed to disasters each year globally.
Asia’s power utilities are losing billions due to climate change

Extreme heat, floods and water shortages are already costing Asia’s power utilities $6.3 billion annually, a figure projected to exceed $8.4 billion by 2050 if companies fail to strengthen climate adaptation measures, research by the Asia Investor Group on Climate Change and the MSCI Institute shows.

Asia accounts for 60% of the world’s power generation capacity and remains deeply reliant on coal. The report warns that climate changes threatens both energy security and economic growth across a region where over 4 billion people need reliable electricity.

“Overall, if you were looking at the types of impacts and the preparedness of companies, most companies are at very early stages,” said Anjali Viswamohanan, director of policy at the Asia Investor Group on Climate Change.

Its study of 2,422 power plants across China, Hong Kong, India, Indonesia, Japan, Malaysia and South Korea found extreme heat to be the costliest hazard, responsible for over half of all losses by 2050. Heatwaves reduce power plant efficiency and strain transmission networks. India’s main power utility NTPC, Indonesia’s PLN, and Malaysia’s Tenaga Nasional all face a high risk of disruptions caused by rising heat.
Disruptions to water are a big factor

Another major threat comes from declining river flows in Asia’s major basins, which supply the water needed by coal and gas plants and fuel hydropower dams.

At the same time, heavy rainfall and flooding also pose risks, especially in coastal and riverine regions. Malaysia’s Tenaga Nasional faces some of the highest coastal flood exposure due to power plants built in low-lying areas, the report said.

Despite mounting hazards, most utilities lacked detailed, funded plans for adapting to climate impacts. The report found that while nine companies of the 11 studied assessed how climate change impacts them, only seven examined risks at individual plants. Just five calculated and disclosed how future climate impacts could raise costs or hurt their earnings.

Rapidly shifting climate risks make it hard to predict the costs and insurance needed to protect energy infrastructure, said Jakob Steiner, a geoscientist affiliated with the University of Graz, who wasn’t involved in either report.

Financing gaps in the power sector may be easier to close than those in water and sanitation, since energy projects can attract strong industry interest and investment, he said. But some countries daunted by demands from international investors for environmental safeguards might turn to regional financiers that are less scrupulous about such concerns.

“For energy infrastructure, I see more hope that the financing gap can be closed,” he said. “But that can also come at a cost.”",Climate Change
"Nearly 1,000 people have been killed, and close to one million displaced, Indonesia has said a week after torrential rains triggered catastrophic floods and landslides.

The National Disaster Management Agency (BNPB) reported late on Sunday that 961 people had been killed, with 234 people missing and about 5,000 injured across the Aceh, North Sumatra and West Sumatra provinces. The agency also recorded damage to more than 156,000 homes, and 975,075 people had taken refuge in temporary shelters.

Floodwaters have begun to recede in several coastal districts, although large areas in the central highlands are still cut off, BNPB said. However, heavy rain is forecast for parts of the island in the coming days, raising concerns for displaced people.

Indonesia’s rainy season, which usually peaks between November and April, frequently brings severe flooding.

Environmental groups and disaster specialists have warned for years that rapid deforestation, unregulated development and degraded river basins have increased the risks.

Several other countries in Southeast Asia, including Sri Lanka and Thailand, have been hit hard by storms and floods in recent weeks.
Risk to billions

The Asian Water Development Outlook 2025, published by the Asian Development Bank (ADB) on Monday, warned that the impact of climate change on Asia’s water systems poses a risk to billions.

The research said accelerating ecosystem decline and funding shortfalls for investment in critical water infrastructure threaten to plunge many in the sprawling region into water insecurity.

That could jeopardise gains over the past 12 years that have seen more than 60 percent of Asia-Pacific’s population – about 2.7 billion people – escape extreme water insecurity, the report says.“Asia’s water story is a tale of two realities, with monumental achievements on water security coupled with rising risks that could undermine this progress,” said Norio Saito, the ADB’s senior director for water and urban development.

“Without water security, there is no development,” Saito said, adding that the report showed that urgent action was needed to restore ecosystem health, strengthen resilience, improve water governance, and deploy innovative finance to deliver long-term water security.
Rising disaster threat

The report said ​​extreme weather events such as storm surges, rising sea levels, and saltwater intrusion, along with rising water-related disasters, threaten the region, which already accounts for more than 40 percent of the world’s floods.

That includes the disasters that ravaged Indonesia and other countries in the region in recent weeks.

From 2013 to 2023, the Asia Pacific region experienced 244 major floods, 104 droughts, and 101 severe storms, causing widespread damage to life and property and undermining crucial development gains.The report said accelerating ecosystem decline was also a serious threat to water security in the region, with rivers, aquifers, wetlands and forests that sustain long-term water security deteriorating rapidly.

It said water ecosystems were deteriorating or stagnating in 30 of the 50 Asian countries it looked at, as they face threats from pollution, unchecked development and the conversion of land to other uses.

Underinvestment in water infrastructure is another threat to water security.

Asian nations will need to spend $4 trillion for water and sanitation between now and 2040, an outlay of about $250bn a year, the report said.

Currently, governments are collectively spending about 40 percent of that, an annual shortfall of more than $150bn.",Climate Change
"

This year’s United Nations Climate Change Conference, known as COP30, opened in Belém, Brazil, with a stark reality check from UN Secretary-General António Guterres: The world has now passed 1.5 degrees Celsius of average warming above preindustrial temperatures. While climate scientists had begun acknowledging that this trajectory was likely, climate negotiators and diplomats understandably have until now preferred an optimistic outlook on the 2015 Paris Agreement ambition to keep temperatures below 2 degrees of warming. And after a woefully weak final agreement, COP30 also ended with another harsh reality: The cooperative and optimistic era of climate diplomacy, epitomized by the Paris Agreement, has given way to a more fragmented and competitive world, in which climate change is taking a back seat to other concerns.

The current U.S. administration has undoubtedly exemplified this shift. President Trump has called climate change a “con job,” as his administration openly torpedoed the International Maritime Organization negotiations, and COP30 featured no official U.S. government representative. While few countries have gone as far as the United States in rejecting climate action, there’s no denying that ambitions have wavered and political urgency has waned across the board. An overwhelming majority of countries—95 percent—were late with their Nationally Determined Contributions, which were the pledges due at this summit to set ambitions for the next decade. And when they arrived, they added up to well under what’s needed to meet the Paris goals.

Despite this gloomy picture, it’s important to acknowledge that significant progress has been made since Paris. The world was on a trajectory for 4 degrees of warming before 2015. Thanks to the COP process and bold climate action from many partners, we’re now closer to 2.5 to 3 degrees. Shaving off 1 degree matters: The reduction will likely save countless lives and livelihoods in the decades to come. Clean energy investments continue to grow, led largely by China, but also by national-level and private-sector innovation. And despite weak final agreement language on emissions, COP30 attendees agreed on other notable initiatives, including the adoption of adaptation indicators to measure country progress and a call for tripling adaptation finance by 2035. Convening 194 countries to grapple with the most challenging issues facing the world can still achieve progress, even if insufficient.

The outcome of COP30 underscores the growing challenges countries have cooperating in the face of an increasingly complex landscape of state and non-state threats from increasingly visible climate security impacts to economic coercion and hybrid warfare. Against this backdrop, COP negotiators were acutely aware of an environment that now includes the sharpening intersection of geopolitical competition and climate politics; the rising urgency of investment in adaptation to manage the climate security impacts unfolding today; and the need to prepare for growing international attention to more radical climate interventions, such as solar geoengineering, as the world falls short of the 1.5 degree target.

COP30 Reflected a Fragmented World

COP30 underscored how much climate diplomacy can shift in just a couple years. In 2023, a U.S.-China agreement on methane ahead of the United Arab Emirates-led COP28 sent a signal to the rest of the world that the two largest emitters were ready to lead. That COP also saw an agreement to create the Loss and Damage Fund, the first-ever COP commitment to “transition away” from fossil fuels, and 95 countries signed a declaration on the nexus of climate change, conflict, and the need to provide finance in the most fragile states. Fast-forward just two years and the picture from Belém was much different.

For the United States, the Trump administration’s abrupt reversal on U.S. climate leadership—including a withdrawal from key agreements, a rollback of domestic green policies, and dismantling of the agency responsible for adaptation and global development—has left many countries questioning whether Washington remains a reliable partner on climate action. In this vacuum, though it stayed relatively quiet in Belém, China continues to expand its global influence through clean energy finance and technology exports, leveraging its dominance in solar, batteries, and electric vehicles to position itself as an indispensable player in the energy transition.

Absent strong leadership from the U.S. and China, COP30 negotiations sputtered; the final agreement took a step backward by not mentioning fossil fuels and resulting in only minimal new commitments of climate finance. To navigate this new more competitive environment among great powers, developing countries framed issues like climate justice, debt relief, indigenous representation, and finance as sovereignty and security issues. Meanwhile, middle powers aimed to leverage the COP as a platform to elevate themselves and their national industries, with mixed success. Oil-producing Saudi Arabia was able to ensure weak language on emissions, Indonesia used the meeting to sell carbon credits, while host nation Brazil failed to secure much funding for its marquee new fund for forests.

Critically, COP is no longer the only game in town for climate cooperation. With bilateral and minilateral cooperation on some issues thriving, private-sector development continuing to grow, and security interests taking up a larger share of national budgets and policy attention, leaders are coming face-to-face with this climate reality: COPs are becoming arenas for soft-power projection and contestation, rather than problem-solving.

Adapting to the Unavoidable: The 1.5-Degree Reality Check

One bright spot at COP30 was the focus on adaptation, though it remains to be seen whether this emphasis will deliver on the meeting’s ambitious goals in this area. Nonetheless, this year’s COP has been the most forward-leaning on adaptation measures, establishing for the first time a set of adaptation indicators against which countries will be measured. The meeting also emphasized new sources of financing, datasets, and tools to make it easier to shift away from traditional, mitigation-focused efforts.

Global leaders already face a massive adaptation gap: Current funding and planning fall far short of the current scale of need, which continues to spread to new regions and sectors. While fragile states and sectors already face destabilization risks from climate change, the Global North is also increasingly finding itself on the back foot after record droughts, storms, floods, and wildfires. Climate change is impacting global stability, with water, food, and energy insecurity driving migration, conflict, and political unrest.

These factors often exist in an intractable vicious cycle. Examples of this phenomenon include the intersection among rainfall cycles, displacement, and conflict in Somalia; drought and displacement ahead of the 2011 Syrian civil war; and more. Notably, when climate change and security intersect, the effects are rarely limited to national borders. Instead, effects tend to reverberate outward due to increased migration, interrupted supply chains, and potential recruitment for non-state armed groups. Without adequate planning and funding, a localized climate disruption can grow to a national—or even regional—disaster.

Recognizing the challenges ahead, both military and humanitarian actors are preparing for these cascading crises, but they need more funding and emphasis on long-term adaptation planning, not pressure from governments or donors to narrowly focus on mitigation. As demonstrated by the cascading risks of a world rocketing past 1.5 degrees, investment in adaptation is not just good development policy—it’s a strategic necessity.

***

Ultimately, COP30 may mark a shift in global climate cooperation. Unlike the political consensus and goodwill that drove the Paris climate accords in 2015, today’s COPs are yielding little more than political rhetoric and unfunded promises. Going forward, the real action will likely be in national strategies, regional blocs, public-private partnerships, and coalitions of the willing.

Instead of clinging tight to the COP system, the challenge for policymakers will be to manage this shift without letting climate governance fracture entirely. This will require them to embrace today’s climate realities: practicing realism about the limits of mitigation, placing more emphasis on adaptation, recognizing the stability challenges to come, and being pragmatic about the venues for cooperation in today’s geopolitical environment.
",Climate Change
