TEXT,CATEGORY
"Republicans want to put the economy at the center of their midterm message as they seek to protect their majorities in Congress. But as cost-of-living concerns mount across the political spectrum, the GOP is struggling to act decisively to address them.

Already top Republicans acknowledge they haven’t done enough to sell the “one big, beautiful bill,” the party-line centerpiece of their economic agenda they enacted over the summer. Now internal divisions and the need for bipartisan support in the Senate are threatening any attempt to follow up on it.

The GOP is struggling to coalesce behind a health care plan that would prevent Obamacare premium hikes set to kick in next month and efforts to rein in President Donald Trump’s tariffs have run aground in the House. Meanwhile, the administration’s proposal to distribute $2,000 rebate checks has gotten a lukewarm response on Capitol Hill and the fate of other smaller bills to address things like housing prices and student debt have sparked intraparty sparring.

“The cost of living is a legitimate issue — I think it was one of the main reasons President Trump was elected. I think it’s still an issue,” Sen. John Kennedy (R-La.) said in an interview, urging Republicans to pursue another party-line bill before the midterms in response.

While many in the GOP — including Trump — continue to lay blame for their economic problems with former President Joe Biden, there are clear warning signs for Republicans. Forty-six percent of respondents in a recent POLITICO Poll said the cost of living is the worst they can remember it being.

That includes 37 percent of those who voted for Trump in 2024, and about a quarter of Trump voters say he is either fully or mainly responsible for the current state of the economy.

Yet top GOP leaders in Congress are keeping expectations low for major new economic legislation. Instead, they are betting on having an easier time addressing affordability questions next month, when new programs enacted as part of the megabill start impacting voters — like no taxes on some tips and overtime income.

“We haven’t probably messaged as effectively as we should,” Senate Majority Leader John Thune said in an interview, when asked about the party’s economic case. “I think we’ll have lots of opportunities now that we’re getting into an election year to talk about the things we’ve done and how they are going to lead to things being more affordable for the American people, probably starting with tax relief next year.”

Speaker Mike Johnson also argued voters have not fully felt the impact of the megabill “because it takes a while for it to be implemented.” But he predicted that by mid-2026, “there’s going to be boats rising in the economy, this is going to be a very different situation before we go into the election cycle.”

“Republicans are dialed in like a laser, with laser focus on the cost of living and affordability,” he added, while forecasting more to come: “They are going to see this agenda going forward — our affordability agenda.”

But there are reasons to doubt an impending turnaround. Some of these same leaders argued this summer, as they strained to pass the megabill, that Americans would feel the economic benefits in a big way by late fall. That never materialized, with Republicans instead bogged down in a monthslong fight over releasing files related to Jeffrey Epstein and a lengthy government shutdown. Trump himself has recently taken to calling the emphasis on affordability a “hoax” perpetrated by Democrats.

Democrats are gearing up to hammer the GOP on the issue, and some of them are hearing some familiar echoes in the promises of a rapid turnaround just around the corner. Democrats said much the same thing after their party passed their own major party-line bills as inflation rose under Biden.

“They are in a bubble from Donald Trump on down,” Senate Minority Leader Chuck Schumer told reporters last week. “Donald Trump says there’s no affordability crisis — what kind of world is he living in?”

Kennedy isn’t the only one talking up the idea of doing a second party-line bill using the budget reconciliation process to overcome a Democratic filibuster in the Senate. The Republican Study Committee, a large bloc of House conservatives, is pushing such a bill aimed at addressing affordability and other issues, and Senate Budget Chair Lindsey Graham (R-S.C.) is vowing to plow forward in laying the groundwork for another reconciliation measure.

But Johnson and Thune have treaded lightly on the prospects for second such bill, which faces uphill odds with the GOP divided on the policy particulars and the midterms drawing closer by the day. Instead attention is being drawn to smaller-bore efforts.

Tony Fabrizio, a top Trump pollster, also urged members of the RSC last week to tackle high prices for prescription drugs and housing — warning members in a closed-door meeting that affordability concerns were a key reason a House special election in Tennessee was so close.

But even a push to attach a bipartisan housing package to the annual defense policy bill sparked an intraparty turf war, pitting Senate Banking Chair Tim Scott (R-S.C.) and Sen. Elizabeth Warren (D-Mass.), the panel’s ranking member, against House Financial Services Chair French Hill (R-Ark.).

Scott said in an interview last week the housing measure is “a great sign that we are looking for ways to address the challenges that we see in real America” and that passing it now would put lawmakers “on the same page as President Trump and the White House.”

But Hill, who plans to advance a separate housing package through his committee later this month, told senators that parts of the Senate bill are unacceptable to most House Republicans and need to be left out of the Pentagon bill.

Rep. Mike Flood (R-Neb.), who is spearheading the House package, said last week he would be “amenable to something that has provisions the House wants and the Senate wants.” Thune, asked if the Senate housing provision would get in the defense bill, crossed his fingers.
Watch: The Conversation
68:39
Economy & Education: US trade rep. Greer and teachers union head Weingarten | The Conversation

But no agreement could be reached over the weekend, and the House released defense bill text Sunday night that did not include the housing provisions.

Other lawmakers are itching to show that the party is addressing other affordability concerns, even if those efforts face an uncertain path to becoming law.

House GOP leaders, for instance, are trying to move long-delayed permitting reform legislation over the floor in the coming weeks, arguing that reducing red tape for energy and other projects would lower the cost of living. And Rep. Anna Paulina Luna (R-Fla.) told reporters Thursday there could soon be a bipartisan effort to force a bill capping student loan interest at 2 percent to the House floor.

“That’s a hint for next week,” she said, when asked if she or a colleague would pursue a discharge petition aimed at sidestepping House GOP leaders who have opposed other forms of student loan relief.

House and Senate Republicans, meanwhile, are having a furious behind-the-scenes debate about how to show they are trying to address health care costs ahead of the end-of-year expiration of Obamacare subsidies used by more than 20 million Americans.

Sen. John Hoeven (R-N.D.) acknowledged “there’s a lot more to do” on affordability beyond this year’s megabill on health care and more: “Obviously, medical inflation is very high.”

But GOP leaders in both chambers are scrambling to figure out what pieces of a health care overhaul to put forward — and getting an earful from competing factions within their own party. It’s possible Senate Republicans this week won’t put a consensus GOP alternative up for a vote alongside the three-year extension Democrats want.

A plethora of rank-and-file options are under development, with Sen. Susan Collins (R-Maine) and Rep. Brian Fitzpatrick (R-Pa.) backing a two-year extension of the subsidies with new eligibility restrictions, Sen. Rick Scott (R-Fla.) wanting to provide more flexibility for health savings accounts and Sen. Josh Hawley (R-Mo.) proposing to make it easier to deduct medical expenses on their income taxes.

“It’s a disaster,” Hawley said. “Health care, as it currently is, is too expensive for everybody.”",Economic Justice
"WASHINGTON — Congressional Republicans are starting to publicly and privately sound the alarm about their party’s disjointed strategy to address Americans’ affordability concerns, with some growing increasingly frustrated with President Donald Trump’s sometimes cavalier attitude toward the subject.

While Republicans say the high cost of living is a problem they inherited from President Joe Biden, many GOP lawmakers still think their party needs to sharpen its own message and platform ahead of the midterms — or else it could cost them their tenuous majorities in Congress.

“If we don’t do that, we would be morons, because the economy is very much on people’s minds,” Rep. Tony Gonzales, a Texas Republican, told NBC News. Democrats “failed to really hammer the economy, and it cost them the election,” he added. “If we as Republicans fail to do the same, it wouldn’t surprise me if we had a similar turnout.”

Nearly two dozen Republican senators, House members, strategists and congressional aides shared their concerns about their party’s handling of affordability in interviews with NBC News. Another six acknowledged the issue but said the party will settle on the right strategy to address it.

Their comments come after Democrats have secured wins in many of this year’s elections, with voters citing economic concerns, and as Trump has dismissed the issue as a Democratic “hoax,” rhetoric that has privately frustrated some Republicans.Even some of the most MAGA Republicans are calling for a pivot. Sen. Josh Hawley, R-Mo., said it’s not enough to fix the message: He said Republicans can only improve their standing by delivering real results to lower costs and grow wages.

“People aren’t dumb,” Hawley said. “They know when they go to the grocery store what it costs and what it doesn’t. They know what their rent costs. They know what their prescription drugs cost. And all of that stuff is too high. And they can’t afford it. And they know that. So we’ve got to deliver.”

Some Republicans have voiced their concerns to GOP leaders in private conversations, phone calls and meetings, according to two Republican lawmakers with direct knowledge of the discussions. One of those lawmakers said they also delivered a similar message to White House aides.

And at least one House Republican — Rep. Jeff Van Drew of New Jersey — said he directly raised the issue with Trump during a call last week, though they were primarily focused on health care costs, which are set to skyrocket if Congress doesn’t act before the end of this year.

“Dozens of members and senators have been voicing concerns for several months to anyone that will listen,” said a Republican strategist who works with congressional candidates. “Senior White House aides have been a part of many of those discussions. Whether those aides have ever relayed the level of consternation to the president, that’s the unknown.”

Georgia Rep. Marjorie Taylor Greene, who was one of Trump’s top allies in Congress until recently, has been among the vocal Republicans complaining that Trump has spent too much time on foreign policy and not enough on domestic issues like the cost of living. Her frustrations led to a public falling-out with the president, which prompted her to announce she’ll resign next month.

The public and private warnings come as Republicans have grown increasingly nervous about Trump’s standing and the broader political environment. Trump’s 36% approval rating in the latest Gallup poll, the lowest mark in his second term, alarmed some in the GOP.

“I do think there’s challenges in a midterm year with our party in power,” Rep. Don Bacon, R-Neb., who represents a swing district and is retiring after this term, said in an interview. “It’s always hard. And then, you know, the president’s poll numbers today were 36% in Gallup, and I don’t think our side should ignore that.”

The Gallup poll found Trump’s approval declining significantly among Republicans and independents. Trump’s handling of the economy — long a strength for him — was at just 36% approval, while his handling of health care and the federal budget were at 30% and 31%, respectively. “I think there’s red flags, and our party should take that threat serious,” Bacon said.

The results of a special election in Tennessee this week, where the Republican candidate prevailed by 9 points in a district Trump carried by 22 points just last year, have also fueled the GOP’s anxiety. Multiple voters who spoke with NBC News cited the cost of living as a top concern that drove them to the polls in that race.

“It’s certainly a wake-up call that the Democrats are gonna be ready to go, and we need to pick up our game on the issues that matter,” Rep. Scott DesJarlais, a Tennessee Republican, told NBC News. “It’s always the economy, but health care has been put on the front burner, and we need to address that.”

The Republican candidate in the race, Rep. Matt Van Epps, even acknowledged the issue during his victory speech in Nashville on Tuesday night.

“Together we’ll bring down the cost of living,” he said. “I’m tired of too many Republicans ceding affordability to Democrats.”
Republican leaders urge calm

Republican leaders have sought to calm members by assuring them that Americans will start to feel better about the economy once key provisions from Trump’s tax law fully kick in next year, such as no tax on tips or overtime and an increase for the child tax credit.

Pressed by NBC News on whether Republicans are doing enough to address affordability concerns among Americans, Speaker Mike Johnson said his message to everybody is to “relax.”

“We are exactly on the trajectory of where we’ve always planned to be. Steady at the wheel, everybody, it’s going to be fine,” Johnson said. “Our best days are ahead of us. Americans are going to be feeling a lot better in the early part of next year.”

But one senior House Republican, granted anonymity to share their views more candidly, believes it would be a mistake to rely on their mega law to assuage affordability concerns, arguing “no one in America knows what’s in that bill.”

This lawmaker also complained that Johnson wasted almost two precious months of their majority — time they could have used to pass more cost-of-living bills or find a health care solution — by keeping the House out of session during the government shutdown. The speaker has defended his strategy, arguing it helped keep the pressure on Senate Democrats to fold, which they ultimately did.

“There’s no key kind of strategic messaging about these major wins in the ‘one big, beautiful bill,’” the senior House Republican said. “This is a blown majority.”Trump, meanwhile, has repeatedly called affordability a “hoax,” a “con job” and a “scam” by Democrats, to the consternation of some Republicans. In an interview with NBC News this week, Vice President JD Vance said that Trump “certainly understands that prices got way too high” but that Democrats are blaming his administration for not immediately solving “affordability problems caused by Democrats.”

“The hoax is the idea that it’s our fault and not the Democrats’ fault. And I do think that’s a totally bulls--- narrative,” Vance said. Johnson made a similar point.

A White House official insisted that the president’s policies have bolstered the economy, pointing to fuel standards and lowering drug prices among the policies that show the president’s ongoing commitment to affordability.

But there are signs the White House knows it needs to show more sensitivity to voters’ perceptions about the economy. Next week, Trump will travel to northeast Pennsylvania — in a competitive area of the battleground state — to tout his economic agenda.

“We’re now cleaning up what they still don’t have any actual solutions for,” the White House official said, referring to Democrats. “It’s more of a narrative thing than a substantive thing. With the trip coming up here, it’s more to reiterate or underscore that we’ve been working on this since Day 1. That’s not changing anytime soon.”

On Capitol Hill, House GOP conference Chairwoman Lisa McClain, of Michigan, told Republicans during a closed-door meeting this week that leadership plans to stay laser-focused on passing bills to tackle costs and vowed to stay on message on the issue, according to two GOP sources in the room. Directly following that meeting, she then touted the GOP’s “affordability agenda” during a weekly press conference and highlighted low gas prices.

Republicans also received a presentation during a Republican Study Committee lunch this week from Trump’s pollster, Tony Fabrizio, who advised them to focus on topics like reducing drug prices when talking about health care and to be cognizant of voters’ feelings about the economy, according to attendees.

“Part of the message from Fabrizio is just identifying things that people relate to. They don’t want to hear about frivolous things. They want to hear about what things that affect them,” said Rep. Doug LaMalfa, R-Calif., who delivered a floor speech on affordability on Thursday.
Changing how voters 'feel'

One of the challenges for Republicans is that while things like gas and egg prices are on the decline, many Americans are still feeling the squeeze from inflation, interest rates and a tightening job market. The Biden administration similarly struggled with whether and how to address voters’ sour perceptions about the economy while some key economic indicators were improving. The reality is, it’s difficult to tell voters how they should feel.

“The economy has to feel better, and feeling better sometimes is subjective,” said Rep. Ryan Zinke, R-Mont., who was Trump’s interior secretary in his first term.

Zinke says that in order for that to happen, interest rates need to come down and tariffs need to actually result in trade deals. Trump’s tariffs have contributed to the high prices and been another source of consternation inside the GOP.

Another challenge is that a major piece of Trump’s tax law was just an extension of the current tax rates, meaning voters won’t feel much of a difference. Rep. Dan Crenshaw, R-Texas, thinks his party needs to do a better job reminding voters what would have happened if Republicans hadn’t acted.

“We do need to say that a lot more, and remind people, ‘Do you know you were about to lose thousands of dollars of your paycheck, and we stopped it?’” he told NBC News.

Yet it’s far from clear Republicans have an agenda that can meaningfully ease the pain voters feel — at least in the coming year.

Sen. Rand Paul, R-Ky., said hopes that prices will come down are misplaced, at least as long as the U.S. keeps adding trillions in debt each year.

“For prices to actually go down — people kind of misinterpret this — we’d have to actually have deflation,” he said. “And what we have is less inflation. So it’s better that prices go up 2% a year than 9%. … But it’s not like slowing down inflation all of a sudden means you go to the grocery store and it's less. It means it’s just not going up as rapidly, which isn’t that satisfying.”

Sen. Jon Husted, R-Ohio, who faces voters next year, cited “permitting reform” first when asked what Congress should do to lower costs. He said that would make it easier to build utility lines and generate energy.

“Things like that, that we have control over, are on the agenda,” he said. “They’re just not yet accomplished, and they need to get accomplished.”

Hawley has pitched his new plan to allow out-of-pocket spending on insurance premiums to be deducted from taxes and to create a $25,000 deduction for medical expenses. He said he’d also like to pursue a cap on prescription drug spending and raise the federal minimum wage, a cause opposed by most Republicans.

Johnson has also promised to hold a vote on a health care proposal before the end of the year. But it’s unclear whether Republicans will be able to get a health care bill to Trump’s desk, especially before Affordable Care Act subsidies expire in January.

If the GOP doesn’t pass an alternative and the ACA tax credits expire — which looks almost certain to happen at this point — that means millions of Americans’ health care premiums will surge next year.

“It is frustrating. It’s a big deal,” Van Drew said, when asked about the prospect of his party letting the ACA subsidies expire. “Affordability, it’s the new buzzword now. And I think the thing that we can do the most immediately right now is the health care issue.”",Economic Justice
