TEXT,CATEGORY
"Former President Joseph R. Biden Jr. on Friday offered a defense of his support for transgender rights, addressing an issue that has prompted debate and soul-searching among Democrats, some of whom attribute losses in 2024 to a focus on identity politics.

Republicans, Mr. Biden said in a brief speech, had “weaponized people’s basic identity and turned it into a political football.”

“They’re trying to turn it into something scary, something sinister,” Mr. Biden said. “But folks, it’s not really about anything that’s all that complicated. At its core, it’s about giving every American an opportunity to be treated with the basic decency, dignity and respect they all deserve.”

The former president’s comments came as he accepted an award from the LGBTQ+ Victory Institute, an organization that supports L.G.B.T.Q. people in public office, and as President Trump has made it harder for transgender people to participate in public life. Mr. Biden spoke at the group’s annual conference, a gathering of several hundred L.G.B.T.Q. elected officials and community leaders in Washington.

The organization described Mr. Biden as assembling “the most L.G.B.T.Q.+ inclusive administration in U.S. history.” About 15 percent of Mr. Biden’s appointees identified as L.G.B.T.Q., according to the LGBTQ+ Victory Institute.

Mr. Biden, 83, has kept a relatively low profile since leaving the White House. His office announced in May that he had an aggressive form of prostate cancer and in October that he had completed a round of radiation therapy.

On Friday, he appeared to relish the laughter as he recounted how, in 2012, when he was vice president, he had expressed his support for same-sex marriage on “Meet the Press” before Barack Obama, who was president then, had done so.

“I got myself in a bit of trouble — good trouble,” he said.

Mr. Biden’s support for same-sex marriage came as a reversal from earlier in his career when he voted for measures that blocked federal recognition of same-sex marriages and cut off federal funds to schools that taught the acceptance of homosexuality in the 1990s. Mr. Biden’s more recent position helped push his party to take a stand on the issue.  

His embrace of trans issues followed. In 2018, Mr. Biden wrote the foreword for a memoir by Sarah McBride, who in 2024 became the first openly transgender member of Congress, representing Delaware.
Editors’ Picks
Liverwort or Moss? Horny Toad or Fence Lizard? Niche Field Guides Can Tell You.
How Thousands of Strangers Chose My Wedding Dress
‘Merrily We Roll Along’ Review: It’s a Hit (Reprise)

As president, he shored up protections for sexual orientation and gender identity under statutes that govern federally funded health care and education. “We see you,” Mr. Biden told trans students at the time.
Trump Administration: Live Updates
Updated 
Dec. 8, 2025, 4:45 p.m. ET37 minutes ago

    A frustrated Congress pushes the Pentagon to produce its boat strike orders.
    G.O.P. senators push health care options as a vote looms on extending Obamacare subsidies.
    Trump backtracks on releasing the video of a disputed boat strike.

In 2022, he signed the bipartisan Respect for Marriage Act, requiring states to recognize valid marriages from other states. The move came after the Supreme Court overturned a constitutional right to abortion, raising concerns that it would use the same logic to reconsider its decision protecting same-sex marriage.

Evan Low, president and chief executive of the LGBTQ+ Victory Institute, said that Mr. Biden had been “intentional about understanding that a historically marginalized community can participate fully and openly in our democracy.”

Mr. Biden’s support for transgender rights stands in contrast to the Trump administration’s efforts to impose strict limits on transgender people, including requiring that U.S. passports reflect the sex on people’s original birth certificates, a reversal of a decades-old policy. Mr. Trump has called transgender teenagers “mutilated” and barred transgender people from serving in the military, asserting that having a transgender identity is “not consistent with the humility and selflessness required” of people who serve in the U.S. military forces.

Mr. Trump has appointed a number of openly gay men to work in or alongside his administration. But he has sought to rescind federally funded programs aimed at ensuring that L.G.B.T.Q. groups receive equal access to education, health care and public accommodations, and to cut H.I.V. vaccine research and funding for L.G.B.T.Q. suicide prevention services.

Those policies have won support from Mr. Trump’s base, as well as from others across the political spectrum. Polls show substantial public support for putting in place restrictions on the transgender rights that the Biden administration had supported. Some Democratic officials and strategists have argued that the party should align itself with public opinion on issues like transgender athletes in sports and medical transition for minors.

But others have suggested that Republican efforts to invoke transgender issues to portray Democrats as out of touch with the mainstream — most famously with Mr. Trump’s 2024 campaign ad tagline “Kamala Harris is for they/them, President Trump is for you” — appeared less effective more recently. For instance, in last month’s race for governor of Virginia, Abigail Spanberger, a Democrat, won despite a focus by her Republican opponent on anti-transgender messaging.

Mr. Biden on Friday said that “because of our national debate” on L.G.B.T.Q. issues, “there are young people sitting alone as I speak, scrolling through social media, wondering whether they will ever truly be accepted for who they are.”

“You are heard, and you belong,” Mr. Biden added, to a standing ovation. ",LGBTQIA+
"The US Department of Justice has moved to eliminate rules protecting LGBTQ+ people from sexual abuse in prisons, a shift advocates say is “reckless and dangerous” and will lead to increased assaults behind bars.

A justice department memo issued on Tuesday said “effective immediately”, prisons and jails will no longer be held responsible for violations of standards meant to shield LGBTQ+ people from harassment, abuse and rape. It also directed inspectors to stop auditing facilities for compliance with those protections. The justice department is in the process of seeking formal updates to the rules, the memo said.

The directive relates to regulations under the Prison Rape Elimination Act (Prea), a longstanding federal law which says incarcerated people should be screened for their risk of facing sexual assault when officials place them in housing and that assessments must consider LGBTQ+ status.
Graphic illustration of silhouette against barred light.
Queer and trans immigrants allege forced labor and sexual assault in Ice facility: ‘I was treated worse than an animal’
Read more

Prea, passed unanimously by Congress in 2003, includes standards aimed at addressing the high levels of violence that transgender, gender-nonconforming and queer people face in jails and prisons across the US. Prea applies to all correctional facilities.

The memo from Tammie Gregg, principal deputy director of the Bureau of Justice Assistance, which is part of the justice department, said the policy shifts were designed to align with one of Donald Trump’s signature anti-trans executive orders. The “restoring biological truth” order, issued on Trump’s inauguration day, called for transgender women to be banned from women’s housing in correctional facilities and dictated that the federal Bureau of Prisons stop providing gender-affirming care to incarcerated trans people.

The Department of Justice did not immediately respond to a request for comment.

Gregg’s memo was sent to Prea auditors, who review compliance with the law, directing the monitors to ignore LGBTQ+ protections in future audits. The justice department, Gregg said, was “currently updating” its Prea standards to align with the president’s order.

The affected regulations, the memo says, include policies mandating that trans, intersex and gender-nonconforming people be “screened for risk of victimization”. It also affects regulations designed to protect LGBTQ+ people from discriminatory pat searches by staff, including rules meant to ensure trans women can be searched by female officers and regulations to prevent invasive examinations of individuals’ genitals.

The memo further affects rules on how employees should respectfully communicate with LGBTQ+ people and requirements that sexual abuse investigations consider whether a perpetrator was motivated by a victim’s LGBTQ+ status.

“The proposed revisions to the Prea standards will lead to increased chaos and violence inside prisons and jails, placing staff and incarcerated people in greater danger,” said Linda McFarlane, executive director of Just Detention International, a human rights group, in a statement. “It will allow rapists to act with impunity. And it is already sowing confusion among prison leaders, who have worked for more than a decade to put in place commonsense rules to end prisoner rape … It’s sickening.”

McFarlane’s group has long trained correctional staff on Prea standards and has had certified auditors on staff. In an interview on Friday, she said the immediate impact was a loss of a critical oversight mechanism, and that she hoped institutions would continue to honor Prea.

Incarcerated trans people have long struggled with abuse, even with the standards in effect, she added: “They are already in grave danger. I’ve never met a trans person in detention who has not experienced sexual abuse or harassment while incarcerated.”

The memo comes even after Trump’s executive order has been blocked in court. Earlier this year, some trans women imprisoned by the Bureau of Prisons were moved from women’s facilities into men’s prisons, but the courts later ordered they be transferred back. The rulings have protected individual plaintiffs, but the majority of trans people in federal custody remain housed in facilities that do not match their gender identity.
skip past newsletter promotion

Sign up to This Week in Trumpland
Free newsletter

A deep dive into the policies, controversies and oddities surrounding the Trump administration
Enter your email address
Marketing preferences
Get updates about our journalism and ways to support and enjoy our work.
Privacy Notice: Newsletters may contain information about charities, online ads, and content funded by outside parties. If you do not have an account, we will create a guest account for you on theguardian.com to send you this newsletter. You can complete full registration at any time. For more information about how we use your data see our Privacy Policy. We use Google reCaptcha to protect our website and the Google Privacy Policy and Terms of Service apply.

after newsletter promotion

Spokespeople for the White House and Bureau of Prisons declined to comment.

Kara Janssen, an attorney who has represented trans women in Bureau of Prisons custody in litigation this year, condemned the memo. “This is putting not only our clients in an incredibly dangerous situation, it’s putting all these facilities in an almost impossible position, with the federal government telling them not to comply with their own laws,” she said. “It’s saying you don’t have to be afraid to violate the law … and you can do these searches as disrespectfully as possible.”

Regardless of any changes to Prea, constitutional protections against cruel and unusual punishment remained in effect, Janssen added: “When people are assaulted as a result of these changes, there is liability for these facilities. That is not going away.”

Shana Knizhnik, senior staff attorney with the American Civil Liberties Union’s LGBTQ & HIV project, noted the memo would create challenges for Prea monitors, with at least one auditor warning in a statement to NPR the memo would make their work “more confusing and more difficult”.

Knizhnik emphasized that Prea remained the law and institutions were required to follow it, but she was concerned about “the signal this sends to officials in charge of maintaining folks’ safety in custody”. She added: “This gives more license to individuals to target trans, intersex and other LGBTQ+ folks in carceral settings and ignore their obligations under the law.”

Knizhnik, who has also represented incarcerated trans people challenging BOP policies, continued: “It’s so important for folks to know that even though the government is denying their existence and trying to put them in harm’s way, there are folks on the outside who care and affirm and want to protect them.”",LGBTQIA+
"It’s easy to feel like Trump and the anti-trans movement are one and the same. He’s certainly pushed forward plenty of anti-trans talking points through his campaign ads, executive orders, stacking of the Supreme Court, and pressure on legislatures.

But while he’s certainly become a figurehead for the movement in some ways, it seems it’s not something he truly cares about on its own merits. And when he’s gone, the anti-trans movement will still remain, and they won’t be as powerless without him as we might hope: Other countries are already showing us how this might play out. The anti-trans movement rose alongside Trump, and he certainly used it to his own ends: He has used it as a distraction from other issues and to drive his cult. He has done massive damage using it, but he never created or defined the anti-trans movement. Anti-trans bills started being proposed in legislatures in 2015, with just 19 bills the year before Trump won his first election, to 1,012 bills this year.

When Trump leaves office —a third term isn’t truly likely, and his health might not see him to the end of his current term — some of the anti-trans measures will likely fall away. When Biden took office, he reversed Trump’s first trans military ban, and that will likely be the fate of the current ban under the next Democratic president. Other things, especially those based on Supreme Court rulings, will likely take longer to shift. But expecting all of that to happen overnight, or without a fight, would be to ignore the true nature of Trump’s anti-trans agenda. It’s not something he’s pushing because he has any genuine feelings about girls sports, but because he is enabling those who stand behind or around him to move their own needles.

We’ve seen his willingness to follow the lead of someone like Russ Vought, one of the authors of Project 2025, when it comes to massive government budget matters. Alliance Defending Freedom and the Heritage Foundation have been behind a huge number of anti-trans bills, messaging, and the general rhetoric that has done so much harm to our community. The organizations and individuals who are behind these bills are true believers in their cause — that is, it’s not 100% political strategy. And while Trump leaving will be a challenge for them, they won’t be going anywhere.

For an idea of just how much of this anti-trans hate is going to stick around — not just in impotent rage but in very real harm — we can look overseas, especially to Britain. One of the United Kingdom’s leading exports to the United States over the past few years has been its transphobia. (Maybe Trump could put a tariff on it, then people might stop buying it?)

The UK’s anti-trans wave ranges from J.K. Rowling’s hate and popularizing hiding anti-trans attacks under the guise of defending women and lesbians, to the now-infamous Cass Review, which as been used as the basis for gender-affirming care bans in the U.S. and was mimicked by the Health and Human Services report in May, which cited Cass 149 times.

The UK’s Conservative Party was in power from 2010 to 2024. Like Trump, they presided over the rise of anti-trans rhetoric, and were campaigning on excluding trans people from public life in the election they eventually lost. It was under their government that the Cass Review was commissioned. The new Labour government, which has more recently taken power, has been weak on supporting the trans community, but has also been less obviously anti-trans.

Despite that, there has been massive damage to the community during the conservatives’ relatively short tenure. The UK Supreme Court ruled that the country’s 2010 Equality Act was based on “biological sex,” and that public women’s spaces and political quotas for women were not for trans women. The UK’s Equality and Human Rights Commission (EHRC) then put out guidance suggesting the exclusion of trans people from single-gender spaces. A leaked proposed update to that guidance would’ve advised business owners to ban people from single-sex spaces based on appearance.

This week, both the Girl Guides (the British version of Girl Scouts) and the Women’s Institute (a women’s organization that has allowed trans women for over 40 years) have now banned trans women and girls from membership. While both groups have indicated they regret having to make the decision, they have said it is necessary to comply with EHRC and avoid legal battles.

It was revealed in November that the Guides have been facing legal action from a parent over their inclusion of trans girls. The parent’s lawyer said “Girlguiding cannot simultaneously rely on an exemption that allows it to provide a female-only association and charity under the Equality Act, while redefining ‘girl’ and ‘woman’ to include biological males. This is legally and linguistically incoherent. It is unlawful and should be immediately withdrawn.”

But while all of this has taken place under the Labour government, it wasn’t because they were pushing for it. The case that went to the Supreme Court was made by For Women Scotland, and it received over a third of its legal funding from the noted transphobe JK Rowling. Similarly, the lawsuit against the Girl Guides is reportedly supported by Maya Forstater, an ally of Rowling who went to court claiming that her “gender critical” beliefs were a protected class that she couldn’t be fired over.

The UK’s anti-trans movement isn’t driven by politics, the leading party, or the prime minister. It’s driven by money and hate. The UK hasn’t been saved by having a politician who doesn’t hate, but it might be doomed by a party that won’t push to institute protections for the trans community.

For trans people to survive in the United States, we don’t just need to be rid of Donald Trump: He won’t take the anti-trans movement away with him when he departs. We need to be rid of the middle ground politicians who want to sit on the fence while trans lives are in jeopardy. We need leaders who will establish strong, real protections in the law.

That doesn’t seem likely under our current political system and with Democrats who want to waiver on trans sports issues because they worry it will alienate hard right voters. We need to see a wider cultural shift to understand and accept trans people, which will require greater representation in media, politics, and the world at large.",LGBTQIA+
"But expecting all of that to happen overnight, or without a fight, would be to ignore the true nature of Trump’s anti-trans agenda. It’s not something he’s pushing because he has any genuine feelings about girls sports, but because he is enabling those who stand behind or around him to move their own needles.

We’ve seen his willingness to follow the lead of someone like Russ Vought, one of the authors of Project 2025, when it comes to massive government budget matters. Alliance Defending Freedom and the Heritage Foundation have been behind a huge number of anti-trans bills, messaging, and the general rhetoric that has done so much harm to our community. The organizations and individuals who are behind these bills are true believers in their cause — that is, it’s not 100% political strategy. And while Trump leaving will be a challenge for them, they won’t be going anywhere.

For an idea of just how much of this anti-trans hate is going to stick around — not just in impotent rage but in very real harm — we can look overseas, especially to Britain. One of the United Kingdom’s leading exports to the United States over the past few years has been its transphobia. (Maybe Trump could put a tariff on it, then people might stop buying it?)

The UK’s anti-trans wave ranges from J.K. Rowling’s hate and popularizing hiding anti-trans attacks under the guise of defending women and lesbians, to the now-infamous Cass Review, which as been used as the basis for gender-affirming care bans in the U.S. and was mimicked by the Health and Human Services report in May, which cited Cass 149 times.

The UK’s Conservative Party was in power from 2010 to 2024. Like Trump, they presided over the rise of anti-trans rhetoric, and were campaigning on excluding trans people from public life in the election they eventually lost. It was under their government that the Cass Review was commissioned. The new Labour government, which has more recently taken power, has been weak on supporting the trans community, but has also been less obviously anti-trans.

Despite that, there has been massive damage to the community during the conservatives’ relatively short tenure. The UK Supreme Court ruled that the country’s 2010 Equality Act was based on “biological sex,” and that public women’s spaces and political quotas for women were not for trans women. The UK’s Equality and Human Rights Commission (EHRC) then put out guidance suggesting the exclusion of trans people from single-gender spaces. A leaked proposed update to that guidance would’ve advised business owners to ban people from single-sex spaces based on appearance.

This week, both the Girl Guides (the British version of Girl Scouts) and the Women’s Institute (a women’s organization that has allowed trans women for over 40 years) have now banned trans women and girls from membership. While both groups have indicated they regret having to make the decision, they have said it is necessary to comply with EHRC and avoid legal battles.

It was revealed in November that the Guides have been facing legal action from a parent over their inclusion of trans girls. The parent’s lawyer said “Girlguiding cannot simultaneously rely on an exemption that allows it to provide a female-only association and charity under the Equality Act, while redefining ‘girl’ and ‘woman’ to include biological males. This is legally and linguistically incoherent. It is unlawful and should be immediately withdrawn.”

But while all of this has taken place under the Labour government, it wasn’t because they were pushing for it. The case that went to the Supreme Court was made by For Women Scotland, and it received over a third of its legal funding from the noted transphobe JK Rowling. Similarly, the lawsuit against the Girl Guides is reportedly supported by Maya Forstater, an ally of Rowling who went to court claiming that her “gender critical” beliefs were a protected class that she couldn’t be fired over.

The UK’s anti-trans movement isn’t driven by politics, the leading party, or the prime minister. It’s driven by money and hate. The UK hasn’t been saved by having a politician who doesn’t hate, but it might be doomed by a party that won’t push to institute protections for the trans community.

For trans people to survive in the United States, we don’t just need to be rid of Donald Trump: He won’t take the anti-trans movement away with him when he departs. We need to be rid of the middle ground politicians who want to sit on the fence while trans lives are in jeopardy. We need leaders who will establish strong, real protections in the law.

That doesn’t seem likely under our current political system and with Democrats who want to waiver on trans sports issues because they worry it will alienate hard right voters. We need to see a wider cultural shift to understand and accept trans people, which will require greater representation in media, politics, and the world at large.",LGBTQIA+
